{
  "$schema": "https://ai-transparency-protocol.org/schema/v2.0.json",
  "eu_ai_act": {
    "article_50_compliant": true,
    "effective_date": "2026-08-02",
    "disclosure_method": ["http-header", "client-widget", "manifest"]
  },
  "policies": [
    {
      "scope": "/blog/*",
      "content_types": ["text", "images"],
      "ats_tier": "ATS-2",
      "ats_extent": "E2",
      "human_oversight": true,
      "description": "AI-assisted blog posts, human-edited and curated."
    },
    {
      "scope": ["/impressum", "/agb", "/datenschutz", "/kontakt"],
      "ats_tier": "ATS-0",
      "ats_extent": "E0",
      "description": "Strictly human-authored legal and contact pages."
    }
  ],
  "transparency_policy_url": "https://example.com/ai-transparency",
  "contact": "compliance@example.com",
  "last_updated": "2026-02-18",
  "generator": "TrueSource AI Middleware",
  "wcag_compliance": "WCAG 2.1 AA"
}
